{
  "version": 1,
  "updatedAt": "2026-10-11",
  "title": "Hand Surgery Exam Prep",
  "topics": [
    {
      "id": "clasped-thumb",
      "name": "Clasped thumb",
      "order": 1,
      "color": "#8b7355"
    },
    {
      "id": "mock-exam-alef",
      "name": "מבחן תרגול א׳ — כירורגיה של כף היד",
      "order": 2,
      "color": "#3f7cac"
    }
  ],
  "questions": [
    {
      "id": "clasped-thumb-646b06",
      "topic": "clasped-thumb",
      "type": "mcq",
      "difficulty": "medium",
      "stem": "A child with a type I clasped thumb is treated with six months of splinting. Which success rates match the age when splinting is started?",
      "options": [
        {
          "text": "First year of life 70%, second year 21%, older than two years none",
          "correct": true
        },
        {
          "text": "First year of life 21%, second year 70%, older than two years none",
          "correct": false
        },
        {
          "text": "About 70% at any age, as long as the splint is worn for six months",
          "correct": false
        },
        {
          "text": "First six months of life 70%, after the first birthday none",
          "correct": false
        }
      ],
      "explanation": "For a **type I** clasped thumb, **six months of splinting** succeeds in **70%** when it is started in the **first year of life**, in **21%** when it is started in the **second year**, and in **none** when the child is **older than two years**. Six months is the length of splinting, not the age at the start.",
      "tags": [
        "clasped-thumb",
        "type-i",
        "splint",
        "age"
      ]
    },
    {
      "id": "mock-exam-alef-2aeedd",
      "topic": "mock-exam-alef",
      "type": "mcq",
      "difficulty": "medium",
      "stem": "בחולה בריאה המועמדת לשחרור תעלה קרפלית בחסימה מקומית, נשאל האם מותר להוסיף אדרנלין לחסימה דיגיטלית. מה ההלכה כיום?",
      "options": [
        {
          "text": "אסור באופן מוחלט באצבעות בכל מינון",
          "correct": false
        },
        {
          "text": "מותר; אדרנלין במינון מקובל בטוח באצבעות, והכלל הישן 'ללא אדרנלין באצבע' הופרך",
          "correct": true
        },
        {
          "text": "מותר רק בגוף ולא בשום איבר היקפי",
          "correct": false
        },
        {
          "text": "מותר רק אם ממהלים 1:10000 ומזריקים בכמות גדולה",
          "correct": false
        }
      ],
      "explanation": "מחקרים הראו שאדרנלין (אפינפרין) במינון מקובל ובריכוז סטנדרטי בטוח לשימוש באצבעות, באגודל ובאף — ואף משפר את איכות החסימה ומפחית דימום. המיתוס הישן של 'אסור אדרנלין באצבע' אינו תקף עוד. מוקד הזהירות היחיד הוא מינון יתר או ריכוז גבוה מאוד.",
      "references": [
        "Green's 8e — Ch01 Anesthesia (p.14)"
      ]
    },
    {
      "id": "mock-exam-alef-75fd14",
      "topic": "mock-exam-alef",
      "type": "mcq",
      "difficulty": "medium",
      "stem": "מהו פרק הזמן המרבי המקובל להפעלת חגור אוור (tourniquet) בזרוע במבוגר, לפני שהסיכון לנזק לרכות ולעצב עולה באופן משמעותי?",
      "options": [
        {
          "text": "כ־30 דקות בלבד",
          "correct": false
        },
        {
          "text": "כ־1.5 עד 2 שעות ברציפות",
          "correct": true
        },
        {
          "text": "כ־4 עד 5 שעות",
          "correct": false
        },
        {
          "text": "אין הגבלת זמן כל עוד הלחץ תקין",
          "correct": false
        }
      ],
      "explanation": "חגור בזרוע נהוג להגביל לכ־1.5–2 שעות רציפות (תלוי לחץ, היקף וגיל); מעבר לכך עולה הסיכון לשפשופים, נמק רקמה רכה ופגיעת עצב. כאב חגור מופיע לרוב לאחר 45–60 דקות.",
      "references": [
        "Green's 8e — Ch01 Anesthesia (p.10)"
      ]
    },
    {
      "id": "mock-exam-alef-0c69b7",
      "topic": "mock-exam-alef",
      "type": "mcq",
      "difficulty": "medium",
      "stem": "אצבע נפוחה בעיגול (fusiform), המוחזקת בכיפוף קל, רגישות לאורך נרתיק הגיד וכאב עז ביישור פסיבי. מה האבחנה, ומה הסימן המוקדם ביותר?",
      "options": [
        {
          "text": "פרוניתשיה; הסימן המוקדם הוא נפיחות",
          "correct": false
        },
        {
          "text": "זיהום פלמרי עמוק; הסימן המוקדם הוא חום",
          "correct": false
        },
        {
          "text": "זיהום חריף של נרתיק הגיד המכופף (flexor tenosynovitis); כאב ביישור פסיבי הוא הסימן הרגיש והמוקדם",
          "correct": true
        },
        {
          "text": "פליגון; הסימן המוקדם הוא אודם",
          "correct": false
        }
      ],
      "explanation": "ארבעת סימני Kanavel (נפיחות בעיגול, החזקת האצבע בכיפוף, רגישות לאורך הנרתיק, וכאב ביישור פסיבי) מעידים על זיהום נרתיק גיד מכופף — מצב כירורגי דחוף לניקוז ושטיפה. כאב ביישור פסיבי מופיע לרוב ראשון.",
      "references": [
        "Green's 8e — Ch02 Acute Infections of the Hand (p.30)"
      ]
    },
    {
      "id": "mock-exam-alef-b47cfd",
      "topic": "mock-exam-alef",
      "type": "mcq",
      "difficulty": "medium",
      "stem": "עובד סיעודי מציג שלפוחיות מקובצות על בסיס אודמתי בקצה האגודל, עם תחושת צריבה, ללא הפשרה. מה הטיפול?",
      "options": [
        {
          "text": "חיתוך וניקוז מיידי",
          "correct": false
        },
        {
          "text": "אנטיביוטיקה נגד S. aureus",
          "correct": false
        },
        {
          "text": "טיפול תומך; אסור לחתוך — מדובר בהרפס ויטלו (herpetic whitlow)",
          "correct": true
        },
        {
          "text": "כריתת הציפורן וקריעת רצפת הציפורן",
          "correct": false
        }
      ],
      "explanation": "הרפס ויטלו הוא זיהום ויראלי (HSV) שלפוחיתי; חיתוך אינו מועיל, מאחר את ההחלמה ועלול להפיץ את הנגיף או לגרום זיהום משני. הטיפול תומך, ולעיתים אנטיוירוס. ההבחנה ממקור חיידקי: שלפוחיות מקובצות, תחושת צריבה, וללא מוגלה מערבלת.",
      "references": [
        "Green's 8e — Ch02 Acute Infections of the Hand (p.23)"
      ]
    },
    {
      "id": "mock-exam-alef-95bcc7",
      "topic": "mock-exam-alef",
      "type": "mcq",
      "difficulty": "medium",
      "stem": "בחולה עם מחלת דופיטרן, מהי ההתוויה המובהקת המצדיקה ניתוח (פשיית מיתר / fasciectomy)?",
      "options": [
        {
          "text": "קונטרקטורה של 15° במפרק MCP בלבד",
          "correct": false
        },
        {
          "text": "קונטרקטורה ב־MCP מעל 30°, או כל קונטרקטורה ב־PIP, או מבחן שולחן חיובי (table-top / Hueston)",
          "correct": true
        },
        {
          "text": "נודול בלבד ללא מיתר",
          "correct": false
        },
        {
          "text": "נוכחות משפחתית של דופיטרן בלבד",
          "correct": false
        }
      ],
      "explanation": "מקובל לנתח כאשר יש קונטרקטורה משמעותית: MCP מעל 30°, כל קונטרקטורה ב־PIP (הפרוגנוזה גרועה יותר ככל שמפגיש את PIP), או מבחן Hueston table-top חיובי. נודול ללא מיתר אינו התווייה לניתוח.",
      "references": [
        "Green's 8e — Ch04 Dupuytren Disease (p.181)"
      ]
    },
    {
      "id": "mock-exam-alef-13363f",
      "topic": "mock-exam-alef",
      "type": "mcq",
      "difficulty": "medium",
      "stem": "בבדיקה היסטולוגית, מה מבדיל מיתר דופיטרן 'בוגר' מנודול פעיל?",
      "options": [
        {
          "text": "המיתר מכיל בעיקר קולגן type I דחוס ופחות תאים; הנודול הפעיל עשיר יותר ב־type III ובמיופיברובלסטים",
          "correct": true
        },
        {
          "text": "קולגן type II שולט במיתר",
          "correct": false
        },
        {
          "text": "המיתר עשיר בתאי שומן",
          "correct": false
        },
        {
          "text": "הנודול מכיל פחות תאים מהמיתר",
          "correct": false
        }
      ],
      "explanation": "הנודול הפעיל הוא המדף הסלולרי: ריבוי מיופיברובלסטים וקולגן type III. עם ההבגרה הופך המיתר לפחות תאי ובעיקר קולגן type I מסודר — ולכן קשה יותר לשחררו.",
      "references": [
        "Green's 8e — Ch04 Dupuytren Disease (p.156)"
      ]
    },
    {
      "id": "mock-exam-alef-08d0f7",
      "topic": "mock-exam-alef",
      "type": "mcq",
      "difficulty": "medium",
      "stem": "אצבע 'מלקט' (mallet finger) טראומטית ללא תזוזה עצמית משמעותית. מה הטיפול המועדף?",
      "options": [
        {
          "text": "סד לקיבוע DIP ביישור 6–8 שבועות ברציפות",
          "correct": true
        },
        {
          "text": "ניתוח מיידי לתיקון הגיד המיישר הסופי",
          "correct": false
        },
        {
          "text": "סד ל־PIP בלבד לשבועיים",
          "correct": false
        },
        {
          "text": "תרגילי תנועה מוקדמת של DIP",
          "correct": false
        }
      ],
      "explanation": "מלקט נובע מקריעה או תלישה של רצועת המיישר הסופית מגב P3. כשאין תזוזה עצמית גדולה, טיפול הזהב הוא קיבוע ה־DIP ביישור או היפר־אקסטנסיה באופן רצוף 6–8 שבועות. ניתוח נשקל בשבר עם תזוזה מפרקית גדולה או אי־יציבות.",
      "references": [
        "Green's 8e — Ch05 Extensor Tendon Injury (p.195)"
      ]
    },
    {
      "id": "mock-exam-alef-b61f43",
      "topic": "mock-exam-alef",
      "type": "mcq",
      "difficulty": "medium",
      "stem": "אצבע 'בוטונייר' (boutonnière) המתפתחת אחרי פגיעת הסליפ המרכזי. מה הרצף הפתופיזיולוגי?",
      "options": [
        {
          "text": "קרע הסליפ המרכזי (central slip) בגב PIP — גורם כיפוף PIP ויתר־פשיטה של DIP בעקבות נדידת ה־lateral bands וולארית",
          "correct": true
        },
        {
          "text": "תלישת FDP מה־DIP",
          "correct": false
        },
        {
          "text": "קרע ברצועה האלכסונית של לנדסמיר בלבד",
          "correct": false
        },
        {
          "text": "היצרות של ה־volar plate",
          "correct": false
        }
      ],
      "explanation": "אובדן הסליפ המרכזי מפחית את מנוף הפשיטה ב־PIP; ה־lateral bands נודדות וולארית ומייצרות מומנט כיפוף ל־PIP ויתר־פשיטה ל־DIP — ומכאן בוטונייר. בטיפול מוקדם — קיבוע ה־PIP ביישור.",
      "references": [
        "Green's 8e — Ch05 Extensor Tendon Injury (p.210)"
      ]
    },
    {
      "id": "mock-exam-alef-24f531",
      "topic": "mock-exam-alef",
      "type": "mcq",
      "difficulty": "medium",